{
  "schema_version": "1.5",
  "project_id": "SAMPLE",
  "generated_at": "2026-09-26T00:00:00Z",
  "result": "VALID",
  "specification": "APPROVED",
  "handoff_status": "ready",
  "summary": {
    "ready_tasks": 3,
    "blocked_tasks": 0,
    "other_non_ready_tasks": 1,
    "errors": 0,
    "warnings": 0
  },
  "errors": [],
  "warnings": [],
  "non_ready_tasks": [
    {
      "id": "TASK-004",
      "status": "NEEDS_DISCOVERY",
      "reasons": [
        "Description contains TBD.",
        "Source requirement FR-AUTH-003 is confirmed, not approved.",
        "Feature FEAT-002 is not in scope (scope: pending_decision).",
        "An acceptance criterion contains TBD.",
        "Unresolved blocker: The lockout threshold is unknown until Q-002 is answered",
        "Unresolved critical question Q-002."
      ]
    }
  ]
}
